{
  "$schema": "https://json-schema.org/draft/2020-12/schema",
  "$id": "https://tuvren.dev/schemas/authority-packet.schema.json",
  "type": "object",
  "required": [
    "packetId",
    "version",
    "boundary",
    "surface",
    "authoritativeSources",
    "forbiddenAuthoritySources",
    "verificationPaths"
  ],
  "additionalProperties": false,
  "properties": {
    "packetId": {
      "type": "string",
      "pattern": "^tuvren\\.[a-z][a-z0-9-]*(?:\\.[a-z][a-z0-9-]*)+$"
    },
    "version": { "type": "string", "pattern": "^\\d+\\.\\d+\\.\\d+$" },
    "boundary": {
      "type": "string",
      "enum": ["framework", "kernel", "providers", "shared", "hosts"]
    },
    "surface": { "type": "string", "minLength": 1 },
    "humanAuthorityRefs": {
      "type": "array",
      "items": { "type": "string", "minLength": 1 },
      "default": []
    },
    "authoritativeSources": {
      "type": "array",
      "minItems": 1,
      "items": {
        "type": "object",
        "required": ["path", "format"],
        "additionalProperties": false,
        "properties": {
          "path": { "type": "string", "minLength": 1 },
          "format": {
            "type": "string",
            "enum": [
              "typespec",
              "cddl",
              "proto",
              "json-schema",
              "conformance-plan",
              "semconv-yaml",
              "fixture-set"
            ]
          }
        }
      }
    },
    "generatedArtifacts": {
      "type": "array",
      "items": {
        "type": "object",
        "required": ["path", "generatedFrom"],
        "additionalProperties": false,
        "properties": {
          "path": { "type": "string", "minLength": 1 },
          "generatedFrom": { "type": "string", "minLength": 1 },
          "generator": { "type": "string", "minLength": 1 }
        }
      },
      "default": []
    },
    "conformancePlans": {
      "type": "array",
      "items": {
        "type": "object",
        "required": ["planId", "planVersion", "path"],
        "additionalProperties": false,
        "properties": {
          "planId": { "type": "string", "minLength": 1 },
          "planVersion": {
            "type": "string",
            "pattern": "^\\d+\\.\\d+\\.\\d+$"
          },
          "path": { "type": "string", "minLength": 1 }
        }
      },
      "default": []
    },
    "bindingProjections": {
      "type": "object",
      "additionalProperties": { "type": "string", "minLength": 1 },
      "default": {}
    },
    "bindingAppendices": {
      "type": "array",
      "items": {
        "type": "object",
        "required": ["language", "path"],
        "additionalProperties": false,
        "properties": {
          "language": { "type": "string", "minLength": 1 },
          "path": { "type": "string", "minLength": 1 }
        }
      },
      "default": []
    },
    "forbiddenAuthoritySources": {
      "type": "array",
      "minItems": 1,
      "items": { "type": "string", "minLength": 1 }
    },
    "verificationPaths": {
      "type": "array",
      "minItems": 1,
      "items": {
        "type": "object",
        "required": ["kind", "target"],
        "additionalProperties": false,
        "properties": {
          "kind": {
            "type": "string",
            "enum": [
              "schema-validation",
              "conformance-plan",
              "interop-smoke",
              "freshness-check",
              "vocabulary-check"
            ]
          },
          "target": { "type": "string", "minLength": 1 }
        }
      }
    },
    "freshnessChecks": {
      "type": "array",
      "items": {
        "type": "object",
        "required": ["artifact", "regenerateCommand"],
        "additionalProperties": false,
        "properties": {
          "artifact": { "type": "string", "minLength": 1 },
          "regenerateCommand": { "type": "string", "minLength": 1 }
        }
      },
      "default": []
    }
  }
}
