{
  "packetId": "tuvren.framework.driver-api",
  "version": "0.1.0",
  "boundary": "framework",
  "surface": "driver-api",
  "humanAuthorityRefs": [
    "docs/KrakenFrameworkSpecification.md#driver-contract",
    "constitution/TechSpec.md#4.6-runtime-driver-contract"
  ],
  "authoritativeSources": [
    {
      "path": "boundaries/framework/contracts/driver-api/spec/typespec/main.tsp",
      "format": "typespec"
    },
    {
      "path": "boundaries/framework/conformance/plans/driver-api-core.json",
      "format": "conformance-plan"
    }
  ],
  "generatedArtifacts": [
    {
      "path": "boundaries/framework/contracts/driver-api/artifacts/json-schema",
      "generatedFrom": "boundaries/framework/contracts/driver-api/spec/typespec",
      "generator": "@typespec/json-schema"
    }
  ],
  "conformancePlans": [
    {
      "planId": "tuvren.framework.driver-api.core",
      "planVersion": "0.1.0",
      "path": "boundaries/framework/conformance/plans/driver-api-core.json"
    }
  ],
  "bindingProjections": {
    "typescript": "boundaries/framework/contracts/driver-api/implementations/typescript"
  },
  "bindingAppendices": [
    {
      "language": "typescript",
      "path": "boundaries/framework/contracts/driver-api/spec/bindings/typescript.md"
    },
    {
      "language": "rust",
      "path": "boundaries/framework/contracts/driver-api/spec/bindings/rust.md"
    }
  ],
  "forbiddenAuthoritySources": [
    "boundaries/framework/contracts/driver-api/implementations/typescript",
    "boundaries/framework/implementations/typescript/drivers/react",
    "boundaries/framework/implementations/typescript/conformance-runner",
    "boundaries/framework/implementations/typescript/conformance-adapter",
    "boundaries/framework/implementations/rust/conformance-runner",
    "boundaries/framework/implementations/rust/conformance-adapter",
    "boundaries/framework/contracts/driver-api/README.md",
    "boundaries/framework/contracts/driver-api/spec/README.md",
    "docs",
    "constitution"
  ],
  "verificationPaths": [
    {
      "kind": "schema-validation",
      "target": "boundaries/framework/contracts/driver-api/artifacts/json-schema"
    },
    {
      "kind": "conformance-plan",
      "target": "boundaries/framework/conformance/plans/driver-api-core.json"
    },
    {
      "kind": "freshness-check",
      "target": "boundaries/framework/contracts/driver-api/artifacts/json-schema"
    }
  ],
  "freshnessChecks": [
    {
      "artifact": "boundaries/framework/contracts/driver-api/artifacts/json-schema",
      "regenerateCommand": "bun run nx run framework-driver-api:codegen"
    }
  ]
}
