{
  "packetId": "tuvren.framework.react-driver",
  "version": "0.1.0",
  "boundary": "framework",
  "surface": "react-driver",
  "humanAuthorityRefs": [
    "docs/KrakenFrameworkSpecification.md#driver-contract",
    ".constitution/tech-spec/contracts/README.md#46-driver-runtime-contract"
  ],
  "authoritativeSources": [
    {
      "path": "boundaries/framework/conformance/plans/react-driver-callables.json",
      "format": "conformance-plan"
    },
    {
      "path": "boundaries/framework/conformance/plans/react-driver-extended.json",
      "format": "conformance-plan"
    }
  ],
  "conformancePlans": [
    {
      "planId": "tuvren.framework.react-driver.callables",
      "planVersion": "0.1.0",
      "path": "boundaries/framework/conformance/plans/react-driver-callables.json"
    },
    {
      "planId": "tuvren.framework.react-driver.extended",
      "planVersion": "0.1.0",
      "path": "boundaries/framework/conformance/plans/react-driver-extended.json"
    }
  ],
  "bindingProjections": {
    "typescript-react-driver": "boundaries/framework/implementations/typescript/drivers/react"
  },
  "forbiddenAuthoritySources": [
    "boundaries/framework/implementations/typescript/drivers/react",
    "boundaries/framework/implementations/typescript/conformance-runner",
    "boundaries/framework/implementations/typescript/conformance-adapter",
    "boundaries/framework/implementations/rust/conformance-runner",
    "boundaries/framework/implementations/rust/conformance-adapter",
    "docs",
    ".constitution"
  ],
  "verificationPaths": [
    {
      "kind": "conformance-plan",
      "target": "boundaries/framework/conformance/plans/react-driver-callables.json"
    },
    {
      "kind": "conformance-plan",
      "target": "boundaries/framework/conformance/plans/react-driver-extended.json"
    }
  ]
}
