{
  "packetId": "tuvren.framework.event-stream-sse",
  "version": "0.1.0",
  "boundary": "framework",
  "surface": "event-stream-sse",
  "humanAuthorityRefs": [
    "https://html.spec.whatwg.org/multipage/server-sent-events.html",
    "docs/KrakenFrameworkSpecification.md#3-streaming-contract"
  ],
  "authoritativeSources": [
    {
      "path": "boundaries/framework/contracts/event-stream-sse/spec/typespec/main.tsp",
      "format": "typespec"
    },
    {
      "path": "boundaries/framework/conformance/fixtures/event-stream-sse-traces.json",
      "format": "fixture-set"
    },
    {
      "path": "boundaries/framework/conformance/plans/event-stream-sse.json",
      "format": "conformance-plan"
    }
  ],
  "generatedArtifacts": [
    {
      "path": "boundaries/framework/contracts/event-stream-sse/artifacts/json-schema",
      "generatedFrom": "boundaries/framework/contracts/event-stream-sse/spec/typespec",
      "generator": "@typespec/json-schema"
    }
  ],
  "conformancePlans": [
    {
      "planId": "tuvren.framework.event-stream-sse.core",
      "planVersion": "0.1.0",
      "path": "boundaries/framework/conformance/plans/event-stream-sse.json"
    }
  ],
  "bindingProjections": {
    "typescript": "boundaries/framework/implementations/typescript/stream-sse"
  },
  "bindingAppendices": [
    {
      "language": "typescript",
      "path": "boundaries/framework/contracts/event-stream-sse/spec/bindings/typescript.md"
    }
  ],
  "forbiddenAuthoritySources": [
    "boundaries/framework/implementations/typescript/stream-sse",
    "boundaries/framework/implementations/typescript/conformance-runner",
    "boundaries/framework/implementations/typescript/conformance-adapter",
    "boundaries/framework/implementations/rust/conformance-runner",
    "boundaries/framework/implementations/rust/conformance-adapter",
    "docs",
    "constitution"
  ],
  "verificationPaths": [
    {
      "kind": "schema-validation",
      "target": "boundaries/framework/contracts/event-stream-sse/artifacts/json-schema"
    },
    {
      "kind": "conformance-plan",
      "target": "boundaries/framework/conformance/plans/event-stream-sse.json"
    },
    {
      "kind": "freshness-check",
      "target": "boundaries/framework/contracts/event-stream-sse/artifacts/json-schema"
    }
  ],
  "freshnessChecks": [
    {
      "artifact": "boundaries/framework/contracts/event-stream-sse/artifacts/json-schema",
      "regenerateCommand": "bun run nx run framework-event-stream-sse:codegen"
    }
  ]
}
