{
  "packetId": "tuvren.kernel.interop-grpc",
  "version": "0.1.0",
  "boundary": "kernel",
  "surface": "interop-grpc",
  "humanAuthorityRefs": [
    "docs/KrakenKernelSpecification.md",
    ".constitution/tech-spec/stack.md#21-compatibility-record"
  ],
  "authoritativeSources": [
    {
      "path": "boundaries/kernel/interop/grpc/proto/tuvren/kernel/interop/v1/kernel_services.proto",
      "format": "proto"
    },
    {
      "path": "boundaries/kernel/interop/grpc/proto/tuvren/kernel/interop/v1/kernel_types.proto",
      "format": "proto"
    }
  ],
  "generatedArtifacts": [
    {
      "path": "boundaries/framework/implementations/typescript/runtime-core/src/lib/generated/kernel-interop",
      "generatedFrom": "boundaries/kernel/interop/grpc/proto",
      "generator": "protoc-gen-es"
    }
  ],
  "bindingProjections": {
    "typescript": "boundaries/framework/implementations/typescript/runtime-core",
    "rust": "boundaries/kernel/implementations/rust/grpc-service"
  },
  "forbiddenAuthoritySources": [
    "boundaries/framework/implementations/typescript/runtime-core",
    "boundaries/framework/implementations/typescript/runtime-core/src/lib/generated/kernel-interop",
    "boundaries/kernel/implementations/rust/grpc-service",
    "boundaries/kernel/interop/grpc/proto/README.md",
    "docs",
    ".constitution"
  ],
  "verificationPaths": [
    {
      "kind": "interop-smoke",
      "target": "boundaries/kernel/interop/grpc/proto"
    },
    {
      "kind": "freshness-check",
      "target": "boundaries/framework/implementations/typescript/runtime-core/src/lib/generated/kernel-interop"
    }
  ],
  "freshnessChecks": [
    {
      "artifact": "boundaries/framework/implementations/typescript/runtime-core/src/lib/generated/kernel-interop",
      "regenerateCommand": "bun run nx run kernel-interop-grpc:codegen"
    }
  ]
}
